id,property_id,transaction_type,amount_aed,transaction_date,buyer_name,seller_name,agent_name,agency,commission_rate,commission_amount,status,payment_method,notes
235,121,Sale,1718381,2024-06-21,المهندس كنان الدباغ,James Simon,Brian Freeman,Smith Group,2.8810321213623205,73460.53553561063,Pending,Bank Transfer,Those first attack practice doctor service. Perform wonder box return itself. Address method major grow weight participant.
236,408,Sale,11826564,2025-01-13,شامخ كانو,المهندس حنبل آل علي,Gregory Jones,آل عطفة-آل عواض,4.6494447325872015,516939.70112546574,Completed,Cheque,Aperiam iure delectus modi facere veritatis. Voluptatibus et reiciendis suscipit. Temporibus dolore quia quaerat repellendus.
237,396,Sale,8325472,2023-10-03,Mrs. Tiffany Scott DDS,الأستاذة ناديه أبا الخيل,زكية الراشد,Yates-Weber,3.573329036252859,246366.01317013692,Pending,Mortgage,Animi nulla atque neque soluta doloribus. Autem minus quisquam optio explicabo quam rem aliquid. Dolores similique incidunt fuga.
238,24,Sale,5791276,2024-08-29,جوانا آل بن ظافر,فارس الخرافي,المهندس خليفة آل الشيخ,شربتلي LLC,2.4221374737027923,204265.19078543023,Under Review,Cheque,"Short contain cold quickly family.
Prepare those none my same. Fish TV hit research care list television. Her lay environment Republican contain hold gun."
239,303,Rent,149449,2024-05-26,يانع فصيل,تمّام آل معيض,Jake Molina,"آل حسين, آل علي and فصيل",2.5706430017634534,6449.882643425326,Under Review,Cash,"Nearly himself allow general success. Huge paper manage two.
Friend sign gun body. Heavy surface military able condition. Policy action professional develop low culture. Stuff ball Mr him take."
240,325,Lease,109594,2024-09-28,كوثر الراشد,عرفات كانو,مُنجد الحكير,المغاولة-آل معيض,2.9817349240156803,4833.508689818381,Cancelled,Cheque,"Molestias dolores amet nisi iure. Fugit deleniti cum minus nihil at illo iure. Et pariatur eos consectetur aliquam a.
Sint blanditiis asperiores laborum. Ut itaque ullam deleniti odit."
241,231,Assignment,189347,2025-07-31,زبير آل قصير,تاج حجار,المهندس ضيائي فصيل,"آل رفيع, المشاولة and آل بن لافي",4.496085818923188,5169.3285123032265,Under Review,Cash,"Right drug out she feel director natural.
Pay worry husband picture character reality. Sea movie able kitchen under word reflect. Wish government push."
242,77,Sublease,147928,2024-08-10,أريج آل حسين,Morgan Dunn,Andre Cox,"آل رفيع, آل رفيع and آل عايض",4.039041367075407,6214.085982150717,Pending,Bank Transfer,"Placeat asperiores repellat tenetur. Quia eligendi ducimus.
Dignissimos error quasi commodi repellendus. A accusantium quaerat explicabo."
243,7,Sale,7495337,2023-09-23,Ryan Moore,السيد ناظم آل رفيع,Heather Charles,Scott and Sons,3.9387847165156837,217870.20525529547,Pending,Cash,"Nor million avoid important head item walk away. Scene best movie. Dog maybe successful science major data religious.
Often table perform drug grow. Build father today."
244,203,Assignment,65010,2025-03-18,Dr. Brittany Morris,Joe Rodriguez,زكي فصيل,"المشاولة, المهيدب and حنبولي",2.16427158001649,1323.8161678571696,Under Review,Cheque,Eveniet quasi rerum necessitatibus quisquam reiciendis dolorum. Beatae rerum veritatis illo veniam architecto. Mollitia sint accusantium at a quod nam.
245,62,Sublease,149820,2024-01-06,Margaret Williams,السيدة جود المهنا,جواهر المهنا,آل خضير Group,3.2481116071900153,7439.292440743203,Pending,Bank Transfer,"Quis qui libero quidem consequatur. Molestiae explicabo quam tempore.
Accusamus praesentium eos. Velit explicabo velit iusto perferendis."
246,497,Sale,1634016,2025-08-15,Crystal Santos,Brandon Martin,زياد الخرافي,"Davis, Rodriguez and Mack",4.327473345250951,46786.57888977174,Pending,Cash,Ex iusto ab neque rem harum quod. Tempora optio optio inventore. Explicabo dolores iusto possimus magnam.
247,334,Assignment,69966,2023-12-06,Amy Hernandez,Jeremy Simpson,Kayla Buckley,آل محمد بن علي بن جماز-المهنا,2.515239987847943,3159.44110884986,Under Review,Mortgage,Consectetur temporibus nisi blanditiis inventore magni aspernatur. Non fugit ducimus tenetur deserunt. Laborum rerum dolores corrupti fugit id maxime sit.
248,94,Assignment,139817,2023-12-28,لورا المشاولة,الأستاذة بلماء المهيدب,الدكتورة جود آل عطفة,Knapp LLC,2.438608151365966,6884.63326238275,Pending,Cash,"Itaque recusandae harum. Excepturi nulla rem impedit error magni cumque.
Quas illo suscipit."
249,438,Lease,65776,2023-09-27,سديم الجفالي,السيدة وصاف الجابر,Victoria Burch,أبو داوود-حنبولي,3.7952944529654866,3023.3885704840895,Pending,Cash,"Dolorum cumque ducimus voluptatum perferendis.
Expedita quam quasi sapiente dolorum cupiditate rem. Quasi voluptates blanditiis deleniti. Modi architecto corporis rerum repudiandae adipisci veniam."
250,499,Assignment,86875,2025-03-30,April Ayers,لوليا آل الشيخ,بتلاء كانو,آل قصير-الخرافي,3.0679948790890794,3565.89660912328,Completed,Bank Transfer,Near run smile most build. Century my building candidate place generation shake.
251,498,Rent,157699,2024-03-26,أجوان المهنا,Carla Palmer,Anthony Decker Jr.,"حنبولي, الحجار and بن لادن",2.378408970714606,6842.335471268432,Pending,Bank Transfer,Fugiat provident ratione suscipit fugit. Dolores error cupiditate suscipit rerum. Nulla vel iusto aspernatur corrupti quidem iste.
252,6,Sale,11467001,2024-07-22,Susan Craig,سعيد بقشان,ضياء آل صفوان,Alvarado-Wilkins,2.6867344011803342,239667.44612517903,Completed,Bank Transfer,Repudiandae debitis libero. Veniam quibusdam quod accusantium delectus eligendi iste. Ea aspernatur debitis. Alias perspiciatis animi odio aliquam.
253,19,Rent,161396,2024-11-12,Brittany Terry,الدكتور شاطر المهنا,Brenda Herrera DVM,Moore and Sons,3.444217834362206,7948.082668293883,Completed,Cash,"Read place appear benefit commercial. Factor shoulder glass. Already identify source like believe.
Raise everybody rule police find far already. Finally grow after parent trial."
254,176,Assignment,127302,2024-05-18,Margaret Vazquez,لوليا المهنا,Joann Davis,آل بن ظافر-آل قصير,4.108319435586356,3834.1629434195197,Pending,Bank Transfer,Quasi dolore voluptatum sed. Delectus a blanditiis ab suscipit.
255,415,Assignment,138923,2025-06-18,Antonio Wells,الدكتور عقيل آل عواض,مقداد الراشد,Hayes and Sons,2.064140423772187,4074.390409738144,Under Review,Bank Transfer,Autem dignissimos explicabo suscipit fuga quia amet. Magnam et quisquam possimus. Nobis nesciunt magnam.
256,128,Sale,4511665,2024-04-27,Bobby Brown,المهندس عبد الحكيم آل خضير,بنان آل بن لافي,"Wilson, Jackson and Mcclure",4.575998147323899,110682.67167734496,Cancelled,Bank Transfer,Itself particular hour guy manage painting something. Between drop type stand war down she explain. Financial relationship moment.
257,24,Sublease,78661,2025-03-13,شدّاد أبو داوود,هيا أبو داوود,المهندسة بهاء آل مقطة,آل رفيع and Sons,2.111766145909459,2338.68971290215,Pending,Cheque,"Trip long degree production rich key. Really water environmental. Especially total federal toward never despite.
Participant modern cost. Operation rule think market audience involve notice."
258,99,Assignment,163417,2025-03-15,مُرسي المهنا,Ms. Stephanie Page,الدكتور ناجح الحجار,آل عطفة Inc,4.283552245502082,4837.036045094571,Pending,Cheque,"Vero assumenda necessitatibus voluptatum sint. Minima reiciendis dicta nulla delectus sapiente pariatur.
Modi laudantium temporibus at exercitationem."
259,287,Sale,11403417,2023-11-07,Kristin Tran,James Branch,المهندسة اعتكاف آل بن لافي,Gardner-Wallace,3.8765957095768435,362939.2664215762,Completed,Cheque,Natus ab provident corporis quis corrupti iusto. Officia debitis praesentium minima quis at consectetur voluptas.
260,492,Sale,3005891,2024-11-05,بنان مهنا,Colin Murray,السيد وجيه آل عطفة,Davidson and Sons,3.0273201463357697,85134.63236361956,Cancelled,Mortgage,Sit nemo odit. Pariatur laboriosam inventore maxime culpa aliquid iure. Asperiores distinctio nesciunt deleniti ducimus.
261,256,Sale,10725509,2023-12-28,Cynthia Flores,Michelle Collins,ترانيم حجار,آل خضير-بقشان,2.1229534774101038,413775.6371907341,Pending,Cash,"Who message change issue project give. Mention what summer seem time door.
Agent above watch during beautiful key. Foreign focus agree international."
262,159,Lease,120291,2023-10-24,ريم الحكير,هند بقشان,هناء أبا الخيل,Thompson LLC,2.3996192230377353,3091.288792390671,Completed,Mortgage,Week collection far politics audience expert sea. We wear million. Baby consider because. Identify use modern economic seat behavior decide century.
263,55,Lease,58761,2025-05-20,آلاء مهنا,Lisa Gordon,المهندسة أزهار أبو داوود,كانو and Sons,4.098367519087269,2213.168433848983,Pending,Bank Transfer,Quaerat animi sit. Voluptatibus molestias quisquam reprehenderit sit aliquid.
264,282,Sublease,149303,2024-06-18,السيد صخر آل الشيخ,عبد الرّشيد آل مقطة,Wesley Khan,آل العسكري-أبو داوود,2.05945708640575,7383.851105612517,Cancelled,Cash,Director audience else source attack play. Food carry stock. Sport window break page. Defense right close successful.
265,315,Sublease,172184,2024-10-03,ليساء آل مقطة,معتوق آل علي,حافظ بقشان,آل قصير Inc,2.6538090626090525,6112.305358092171,Under Review,Cash,"Hundred remember all fall teach garden ago. According sort evening which.
Main challenge doctor office street. Try American man daughter loss walk."
266,198,Rent,58217,2023-11-03,Mary Murphy,الدكتورة هدى آل عايض,Jason Jackson,"Harris, Adams and Brown",3.324496040285978,1683.2844304852213,Cancelled,Cheque,"Quae eius expedita quis delectus necessitatibus asperiores dolor. Nam ab odit nemo nostrum dolorum consequuntur sint. Dolorem id non at.
Ut quo dolorum architecto modi."
267,98,Sale,10423528,2023-12-27,Harry Meyer,الآنسة بوران الدباغ,Martha Valdez,"آل علي, حنبولي and الراشد",2.3206146966912518,251437.96735563833,Under Review,Cheque,Tempora debitis deleniti. Unde quaerat ullam ea ratione maxime autem. Quisquam eos asperiores molestias temporibus eveniet.
268,126,Sale,9935051,2025-04-27,Adam Chandler,بدرالدّجى الجابر,الآنسة روبين الراشد,Vazquez and Sons,2.90144385916048,451709.3034792425,Under Review,Cheque,"Movement sort main. Drop common value evening.
Attention main ten lay treat hair kitchen. Participant think treatment decide claim top fear meet. Sell figure first specific service spring tough."
269,40,Sublease,111673,2023-11-02,Edward Knight,الدكتور صامد آل مقطة,السيد ظهير آل علي,آل عواض-آل عطفة,4.311072903554752,3735.7057870331355,Under Review,Bank Transfer,Expedita nulla facilis iste modi ducimus sed. Dignissimos voluptatibus laboriosam odit iusto dicta hic. Repudiandae quidem distinctio a.
270,429,Rent,101014,2025-02-12,Linda Brown,Andre David,Desiree Mendez,"الخرافي, حجار and آل الشيخ",4.971655037707666,2260.7475859407195,Completed,Bank Transfer,"Economic performance computer statement purpose individual. Significant blue bag time tax. Race operation open these push.
North budget current choice detail. Not explain however stock party see."
271,71,Assignment,107937,2023-12-08,حياة العليان,Kyle Williams,Rodney Norman,Mooney-Lee,3.1557921032752674,3330.0410666470916,Under Review,Mortgage,When raise name require simple themselves. Enough top section high sell full author campaign. Themselves and according thus.
272,330,Sublease,130773,2024-09-06,Mark West,فارس آل رفيع,بتول الراشد,آل حسين Group,3.3038531171078778,3846.501429472795,Cancelled,Bank Transfer,Nam tenetur cum a. Facilis mollitia tenetur quasi vitae hic eos. Maxime assumenda totam laboriosam quis iure. Occaecati provident distinctio quia.
273,51,Sale,10893295,2024-04-15,Ashley Goodwin,السيدة سبأ آل قصير,أناهيد آل بن لافي,آل بن لافي-بن لادن,4.595199920664054,282705.36720207793,Cancelled,Mortgage,"Argue success anything detail instead should book. Visit describe night effort measure value film.
Kid after budget maintain receive there. Own magazine way decide throughout arm."
274,289,Assignment,55738,2024-08-01,جهاد آل عطفة,Thomas Campbell,Lori Smith,Castillo LLC,3.16834553786681,2428.7622839606547,Pending,Mortgage,Soluta corporis perspiciatis amet aspernatur repellendus doloremque. A suscipit laboriosam ipsum doloribus nostrum saepe est. Vero est corporis error at quod fugit quae.
275,485,Assignment,52800,2024-07-31,Bryan Downs,Tina Henson,Amanda Howard,"آل معيض, الدباغ and أبا الخيل",4.585592211650837,2498.297297516402,Under Review,Cash,Hic error repellendus et aliquam quas explicabo ut. Non quod quia similique qui illum. Minima debitis officia itaque a delectus.
276,403,Rent,180270,2024-07-21,المهندسة ريناد المهيدب,Mary Ross,Tamara Watkins,Foster PLC,2.6072382702097676,5369.62417441076,Completed,Mortgage,"Environmental skill measure see. More through which church floor.
Fall along trade. Whether response bed value soon professor."
277,73,Lease,175290,2024-10-30,المهندس فيصل الراشد,Walter Ward,Brittany Rodriguez,آل عواض-بن لادن,2.3552625708077004,3509.9168243511294,Pending,Mortgage,"Ok until discussion save. Budget value not finally.
Order idea five somebody ahead. Mouth industry political memory education.
Third minute sound end discussion. Serve travel find recently."
278,247,Sale,10824784,2025-02-05,Christine Garza,لوجين آل العسكري,Crystal Morrison,"Mann, Johnson and Moore",4.678609101904909,306843.4177993717,Under Review,Mortgage,"Now short brother discussion. Meeting season fish mention. Role project citizen address sort effect score would.
Side vote cup or claim. Eat fight turn control. Scene none bad suggest."
279,307,Sale,1885099,2023-10-24,Angela Moore,Douglas Franklin,Eric Pollard,Shaw LLC,4.617495326158286,52602.616144201485,Pending,Cheque,"Project it wear what place situation.
Nor compare without quickly happen arrive. Interview fill like science. Growth difficult stuff may create sing foreign wear."
280,242,Sublease,120427,2025-01-15,جمان آل سلطان,Jeffrey Johnson,Teresa Thomas,"المهيدب, فصيل and العليان",4.285576069316783,3633.73233373574,Under Review,Mortgage,Power operation attack reduce office crime. Other add section school leave add rich degree.
281,230,Sale,8944024,2025-03-01,Vickie Sellers,الآنسة فرات العجلان,المهندس فيّاض أبا الخيل,Trujillo Ltd,3.9983883369288273,274684.70683508937,Pending,Bank Transfer,Down natural actually marriage compare. Truth why traditional fine as game law.
282,47,Sublease,63666,2024-12-15,ابتكار العجلان,الدكتور خليفة آل مقطة,الدكتور عزّت آل جعفر,Thomas and Sons,2.260274236716117,2786.3449798108913,Under Review,Bank Transfer,Tend page article why. Though artist season thought talk authority. Senior course describe cost pressure station.
283,296,Rent,53565,2023-09-25,الدكتور صعب آل علي,Matthew Huff,هناء آل رفيع,Farmer Inc,4.403991755388733,2406.199985895411,Cancelled,Cash,Occaecati laborum expedita fugit suscipit quaerat. Nemo dignissimos animi similique ullam omnis. Reiciendis accusantium perspiciatis delectus.
284,482,Sublease,156016,2024-07-08,Carrie Downs,اصيل أبو داوود,ظاعن الحجار,آل عواض-العجلان,4.90794164263389,3278.842443638366,Completed,Cheque,"Maxime odit quaerat perspiciatis. Accusantium iste quaerat rem repellat beatae.
Laborum iusto numquam expedita ipsum. Non recusandae rerum harum quod facilis dolorem."
285,67,Sublease,97213,2024-03-23,دانة آل العسكري,Paula Williamson,Frederick Saunders,آل محمد بن علي بن جماز LLC,2.7492549918952354,1954.8971647611559,Cancelled,Cheque,"Rate represent still issue lay range.
Miss worker outside more color sense animal. Guess look politics sign page unit."
286,136,Assignment,143849,2024-02-23,Erika Jenkins,دارين آل خضير,بلقيس الحكير,West Ltd,2.0461480025255865,6811.5380503663,Cancelled,Mortgage,"Iure voluptatem ab pariatur at alias. Eius similique suscipit consectetur porro quas. Consequatur eaque sit dolore expedita nemo.
Sequi eum odit."
287,384,Sublease,156959,2023-10-23,راما آل بن ظافر,Manuel Wilson,فخري آل قصير,"آل بن لافي, آل حسين and المغاولة",3.423672619246678,6065.487835630935,Under Review,Cash,"Fugiat consectetur eligendi consectetur eius in. Fugit ad maxime veniam.
Veritatis vitae sunt ullam ea. Animi velit accusamus occaecati quo veniam."
288,385,Assignment,129039,2024-11-13,كليم آل الشيخ,Colleen Summers,الآنسة زكية آل حسين,المهيدب Ltd,4.421756268242195,5085.746103024993,Cancelled,Cheque,Themselves seem during music. Early score lose customer box baby record. Poor down even amount effect no right.
289,95,Assignment,92848,2025-03-03,المهندس حيدر آل بن لافي,Ashley Burnett,Francisco Duffy,"المهنا, الجفالي and آل عايض",3.617224991794869,3538.269446845627,Pending,Bank Transfer,"Sister then center least eat actually. When she wish.
History first trouble side pull long. Popular close probably daughter represent. Fight war situation receive soon idea."
290,110,Sale,9836406,2024-05-18,David Fernandez,Mary Jackson,Joshua Gilbert PhD,"المهنا, آل عايض and الدباغ",4.181927634351558,309658.8721080905,Under Review,Mortgage,Price show rather help prevent room lay.
291,276,Sale,10385252,2024-07-18,مهدي آل خضير,المهندس نور آل عواض,Michael Nguyen MD,Phillips-Horton,3.8328148095693466,517593.469011232,Under Review,Cheque,Trouble likely check fund of per. Expect because challenge option idea. Offer sport consumer stand else. Certainly make kitchen.
292,170,Sublease,147044,2024-07-04,الآنسة ياسمين آل عواض,Tanya Liu,الأستاذ طلال آل بن لافي,Thornton LLC,3.908170529674334,6072.711950047259,Under Review,Cheque,Spring very technology move along yourself instead. Respond poor follow rich if head. Affect throw Mrs let education environment.
293,73,Assignment,86915,2023-11-02,المهندسة ميسون الراشد,ريمان المهيدب,ماذى أبا الخيل,Huffman-Arnold,2.019597857362794,3366.4289369732332,Completed,Cheque,"Rate become Republican. Common question their what probably. Various about bring shake near wide between song. Animal involve base.
Place condition decide. Do point play job truth."
294,123,Lease,75379,2024-06-12,Priscilla Taylor,المهندسة ريناد بقشان,الآنسة مايا بن لادن,"Ross, Horton and Lucero",2.3028416162036622,2668.5346305650232,Pending,Mortgage,"Human easy write source. Institution edge third mother light.
List allow mouth drop rest data support. Call successful question paper."
295,174,Rent,58296,2024-07-04,قانت الحجار,ريناد أبا الخيل,صدقي آل جعفر,"العقيل, الشايع and العليان",2.3080266042592856,1744.6259345058447,Under Review,Mortgage,Veritatis quas reprehenderit odio dolor sint corporis. Ipsam tempore officia natus unde.
296,483,Lease,199645,2024-02-02,Mrs. Amanda Duran,أريج الخرافي,Margaret Bishop,الشايع-آل قصير,2.3589771252983107,7768.110899761169,Cancelled,Cheque,Libero quasi soluta itaque vero fugit autem. Fugit neque illo ad nemo possimus consequatur. Quisquam magni et.
297,14,Sublease,166228,2024-10-29,Daniel Oneill,Carrie Rodriguez,بثينة الحكير,"Rollins, Reid and Bell",3.359566929333524,6455.170057165363,Pending,Mortgage,"Week attorney score anyone one. Market room his realize majority. Act suggest particular rest.
Style happy son. Really interesting that law."
298,351,Rent,131946,2025-08-23,راسم آل محمد بن علي بن جماز,Derrick Payne,المهندس رامي المهيدب,"Miller, Curtis and Chen",4.374481385213411,4793.291226081837,Pending,Bank Transfer,Million trip like season beautiful. Maintain walk laugh. Out include number create close lot owner cut. Citizen success left.
299,172,Rent,65479,2024-07-05,Jamie Edwards,الدكتورة دارين أبو داوود,زين آل عواض,فصيل and Sons,3.598126512105964,1864.9211195801574,Pending,Cash,Dignissimos rerum beatae similique id nam numquam. Dicta facilis doloribus dolor.
300,346,Sale,1262834,2023-09-20,إلينا المهيدب,فايد آل محمد بن علي بن جماز,Teresa Martinez,"الخرافي, الدباغ and بن لادن",3.30772753622415,59579.02853858399,Under Review,Cash,"Kitchen thus skin each change five summer. Professor degree international avoid too option program.
Federal between usually understand Democrat. Once ahead rock onto let agency possible reach."
