id,property_id,transaction_type,amount_aed,transaction_date,buyer_name,seller_name,agent_name,agency,commission_rate,commission_amount,status,payment_method,notes
1,116,Sale,11923882,2023-09-30,شامخ آل علي,سلاف بن لادن,دعاء الجفالي,الحكير-آل خضير,2.1370073095939244,568588.744396508,Completed,Mortgage,"Quasi in laudantium corrupti commodi placeat. Debitis incidunt aut odit veniam voluptatum excepturi cumque.
Explicabo nisi sequi tempore sunt esse atque. Magnam quam officiis repudiandae minus odio."
2,256,Lease,198954,2024-12-09,Bob West,الأستاذ فاضل الحكير,صعب آل سلطان,"آل الشيخ, آل سعود and آل علي",2.918164350691226,4623.611655645401,Pending,Bank Transfer,Recusandae soluta in fugiat repellendus distinctio. Explicabo quae natus earum. Voluptas placeat quia eligendi eius.
3,60,Rent,190247,2024-02-22,Susan Kim,James Ramirez,Kathryn Delgado MD,Rodriguez Ltd,3.1013342348017403,6181.010005948052,Completed,Cheque,"Special box three. Hand century issue draw at. Hour way care country couple bag conference. Site budget or shoulder store show.
Else local pull own entire. Past happy door control every."
4,362,Assignment,103094,2023-10-09,الآنسة غيداء آل محمد بن علي بن جماز,Kim Ross,Mr. Kevin Hull MD,حجار PLC,2.029757760864804,4743.555562772512,Pending,Mortgage,"Just line simply available. Usually soldier section each up two.
Difference might agree do both election. Reflect pressure student present."
5,203,Sublease,169485,2024-04-26,Norman Smith,ميسون الجفالي,Kevin James,"الراشد, آل خضير and آل بن ظافر",4.007204887729575,7673.401739956091,Pending,Cash,"Water take month. Foot bit partner major population that response.
Well single management tonight lot yes. Garden hold none exactly animal hot. Her whom myself discover ago fish."
6,392,Lease,63055,2023-09-03,الدكتور كافور آل مقطة,الأستاذة كاملة الجابر,الدكتور صخر الشايع,Cunningham PLC,3.200516684914904,2468.214475484741,Cancelled,Bank Transfer,Use page finish continue. Your all cold prepare street. Attorney raise sell director since.
7,459,Lease,64380,2024-03-19,الدكتورة روبين آل حسين,عزمي آل عطفة,سلسبيل آل سعود,Young LLC,4.858284854784719,2272.210518865517,Completed,Cheque,"Position cup pick company. Drive sign us ok yourself vote almost. Miss fund future among body should president.
Box hundred either picture term popular."
8,460,Lease,159005,2024-12-12,الأستاذة بتول العقيل,Meagan Estrada,Thomas Mayo,"Johnson, Newman and Alvarez",2.400096429905643,7807.173918948563,Cancelled,Cash,"Democratic guess its impact. Sometimes market so bring. Note assume claim population he.
Side painting however specific. Executive be ok role camera."
9,385,Sublease,57058,2024-04-18,طلال آل قصير,Tiffany Gonzales,نعيم آل رفيع,"Nicholson, Hansen and Perez",2.0999113586563896,1507.4648463825692,Cancelled,Cash,"Family tend model early he church someone. Discussion present open six let wall itself.
City think office give improve hand various. Sit hundred then be so some world."
10,430,Sublease,94657,2024-09-06,مجاهد حجار,سبأ آل جعفر,الدكتورة لارا فصيل,"آل حسين, المشاولة and العجلان",4.717195321095041,3372.472738306433,Pending,Cheque,"Repellat tenetur placeat. Molestiae animi voluptatum praesentium quis non.
Molestiae quas sit nulla ratione voluptates."
11,376,Sale,1854578,2024-04-03,Robert Williamson,جمان آل قصير,شبلي آل سعود,آل عطفة PLC,2.4679289266627213,90985.04340075889,Pending,Mortgage,"Bank before four stand rest to physical. Again power everything understand.
Office rock red drug. Help in glass throughout who eight."
12,112,Lease,195344,2024-07-22,Denise Lopez,Deanna Hansen,المهندسة جلنار آل الشيخ,"Robinson, Olsen and Flores",3.6061074560089783,7276.4983023515915,Cancelled,Cheque,"Military growth memory. Class particularly alone give science industry drug. Rock recent small growth field bag ahead.
Field understand my support. Anything choice special pick compare like."
13,340,Sale,3708654,2025-04-12,عابد العجلان,المهندسة افتكار الجابر,Aaron Garza,"Burch, Trujillo and Howell",4.585016215974061,183618.1989677149,Cancelled,Cheque,Voluptas nihil libero maxime at odit. Aliquid repudiandae quis minima commodi. Dolores nobis explicabo excepturi quis repellendus.
14,147,Rent,81632,2024-11-28,Rebecca Harrison,السيد عذب المغاولة,الدكتورة سلسبيل أبا الخيل,Smith PLC,3.3876547765278513,2618.2198413349142,Pending,Mortgage,"Their family could management. Writer practice eye hospital everyone must. Majority see hear federal cold early market.
Tv safe happen standard."
15,89,Sale,6283387,2024-02-04,المهندسة نوال الحكير,ابتسام أبا الخيل,Sarah Sparks,"James, Henderson and Wood",2.714762719096078,147432.52844481074,Pending,Mortgage,Quos vel pariatur veniam aut ut. Vero dolores nesciunt vel dignissimos ea. Eveniet tempora nobis commodi earum unde eius.
16,174,Rent,119367,2023-09-16,Thomas Martin,Kevin Graham,بنان الشايع,Young Ltd,2.433730079643831,4052.837350859295,Under Review,Bank Transfer,"Fast card worry everyone few stand. Number teach evidence whether special.
Population worker avoid bank. Money front start station control citizen.
Expect take evening serve bad raise."
17,255,Rent,148713,2025-07-14,Jade Garrison,ترف الجفالي,الآنسة مريم آل علي,Ryan Inc,3.093742123834731,6475.069521884739,Cancelled,Cash,Local about appear. International section because. Character sport food. Wrong market action threat do.
18,249,Sublease,96344,2023-10-26,السيد راسم الحكير,Joshua Berry,الآنسة جوان بقشان,Colon PLC,2.0451475142788436,3886.717228432764,Under Review,Mortgage,"Identify create move study cover work. Interview those investment say Republican none open. Future out center trade you baby community.
Hotel enough production wonder go use. Everybody ball it close."
19,387,Sale,6354417,2024-10-19,Carolyn Torres,السيدة آيات الجابر,Whitney Mills,العليان-أبا الخيل,3.6195897446881995,307483.0783652683,Under Review,Cash,"Whether fact figure magazine think more. Call your month smile successful material.
Choose share doctor admit away job. Bill mind make."
20,1,Sale,4110499,2024-07-12,السيد مناف آل سلطان,Dawn Burch,Sherry Bennett,Macias LLC,2.2066534252504133,135502.2396942181,Pending,Mortgage,"Eveniet doloremque laboriosam sapiente modi corporis voluptas. Quae nam nostrum praesentium.
Doloribus aliquid occaecati dolorum in."
21,154,Sale,8568643,2025-03-03,Michelle Duncan,Nathaniel West,الآنسة سلاف المغاولة,"المشاولة, شربتلي and آل علي",4.449717166847671,249656.40110964616,Under Review,Cheque,Ducimus provident necessitatibus non eveniet necessitatibus nobis ea. Nostrum assumenda fuga animi ad in.
22,429,Rent,167996,2024-09-06,جرّاح آل عايض,جميل العجلان,Ashley Knapp,آل سلطان PLC,2.498677876022628,6676.162005908053,Pending,Cheque,"Weight a able really value reason. Generation table explain already. State which image successful.
Anyone sister fill. Never including different reduce color act. Cell take financial instead fight."
23,84,Sale,11612212,2025-03-13,الأستاذة بلسم فصيل,Shannon Smith,فردوس آل حسين,آل خضير-المغاولة,2.6394045953584255,545994.1971407239,Under Review,Bank Transfer,"Praesentium numquam voluptate tempore odio dolor nobis laudantium. Incidunt nam quo ut odit quia odio.
Iusto facilis iusto cum cumque iste cumque. Ut incidunt ducimus est magni."
24,326,Rent,139418,2024-10-18,Cameron Friedman,Michael Smith,Melissa Hardin,Foster-Santana,3.855353471282813,4532.3313387248045,Under Review,Bank Transfer,"Glass present surface friend. On take race hold practice professional. Deal end north shake idea system less.
Upon laugh will inside indeed test similar. Throughout fund hard compare move."
25,406,Assignment,172411,2024-01-04,Mrs. Megan Lopez,المهندس طالب الراشد,Shelly Sullivan,Morrison Inc,3.0576147118754924,3828.0107658643215,Cancelled,Cash,Omnis vitae aliquid voluptatum cupiditate animi placeat. Sit error ipsa eum ad impedit. Debitis rem reiciendis delectus consequatur eligendi.
26,456,Rent,102704,2024-07-29,الأستاذة لورين آل رفيع,Ryan Wong,Donna Jones,آل معيض Inc,4.681241099916928,2197.63217307178,Pending,Bank Transfer,"Nobis beatae quam expedita dignissimos. Fuga maiores illo. Ea aspernatur perferendis est amet aliquam.
Fugit tenetur possimus esse. Eveniet commodi voluptatem debitis similique perferendis nam."
27,310,Sale,2962957,2023-12-11,أريج آل سلطان,فضل الحجار,المهندس حسام أبا الخيل,"Landry, Ford and Holmes",4.001146266334359,68450.08301697376,Under Review,Mortgage,Everything reflect picture machine mind officer. Language right issue common smile ask city.
28,88,Lease,116620,2023-09-20,Cristian Silva,المهندس مفيد آل عطفة,السيد حسيب آل العسكري,الحجار-فصيل,2.8453119507217037,2876.2444568623737,Under Review,Cash,Laudantium culpa dolorum corrupti. Nobis eum nobis tempora. Eaque blanditiis explicabo nisi adipisci deleniti.
29,87,Sublease,69946,2024-09-02,المهندسة لوجين آل معيض,Jackson Herrera,ليم آل صفوان,أبا الخيل and Sons,3.83341359349801,1563.2592028475133,Cancelled,Bank Transfer,"Church then relationship interesting senior huge.
Address you within direction area. Teacher serve government. Water material charge image store pass."
30,70,Rent,84278,2024-02-23,Christine Nichols,يافع الخرافي,السيد مأمون فصيل,"Suarez, Arnold and King",4.615817430719103,2767.597272629273,Completed,Bank Transfer,"Corrupti dignissimos unde. Incidunt doloremque laborum molestias.
Minus pariatur omnis odio sequi officiis. Magni autem sequi maiores corporis. Quaerat reprehenderit quaerat deserunt."
31,18,Rent,138128,2023-09-05,الأستاذة جمان الحكير,Kelly Williams,Spencer Nolan,"حنبولي, الخرافي and آل بن لافي",4.037551435018861,6649.929026566215,Completed,Bank Transfer,Like front poor. Hard sign television we probably bad court. Clearly care watch spring cost party force. Only court western together.
32,200,Sublease,193423,2024-07-03,Jeremy Lowe,جودي الجابر,Alyssa Garcia,آل محمد بن علي بن جماز and Sons,4.512945502749943,7533.970404731189,Completed,Cash,"Day machine street couple your.
Write agent road character. After strategy hit operation value material others. Foot send say almost direction street western."
33,209,Sale,2595109,2024-11-05,David Maldonado,Jordan Mckinney,الدكتورة ديمه آل عطفة,"العقيل, حجار and أبا الخيل",3.7964760874328167,109013.37200187992,Completed,Mortgage,"Laugh these win tough. Customer upon gun. Position attack improve now account per.
Four pull perform. Seven entire reflect window pull. Note cut individual."
34,162,Sublease,138944,2024-06-06,William Moreno,مروان آل محمد بن علي بن جماز,طارق بن لادن,آل صفوان-آل قصير,4.19622220542232,6722.902778081898,Cancelled,Cash,Benefit off fish wait add hour. Some dog idea meet. Step scientist seem develop college still.
35,396,Sale,9100286,2024-12-11,Lucas Weaver,الأستاذ معين آل بن لافي,المهندس ساطع آل خضير,آل عايض Group,2.0636622788066123,257508.34365090323,Completed,Cash,Blanditiis doloribus tempora nesciunt. Nemo porro est libero neque minima. Ipsa magnam voluptatem reiciendis iusto at expedita.
36,488,Lease,154459,2025-01-06,الأستاذ لهفان آل الشيخ,المهندسة روبا الخرافي,الأستاذ خافق كانو,"Cook, Powers and Hernandez",2.417528236545925,5141.576846206892,Completed,Cash,Possible any down. Of herself least arm. Statement personal lose article car well school.
37,436,Sublease,187124,2024-04-08,Deborah Butler,الأستاذة اصيل الخرافي,ميرا آل حسين,"آل سلطان, المغاولة and العجلان",3.9385460353098942,4801.810412450767,Under Review,Bank Transfer,"Quas explicabo dolores unde. Vitae fuga pariatur laudantium facere ab.
Dignissimos soluta nemo eius."
38,499,Sublease,140601,2025-02-05,نوّار آل الشيخ,Amber Mcdonald,الدكتور ثاقب أبو داوود,"مهنا, العقيل and حنبولي",4.109679125493596,6563.187063883246,Pending,Bank Transfer,Eaque similique beatae vel quasi. Aut eius quas dignissimos quasi perferendis.
39,373,Lease,86452,2025-05-06,اعتماد آل عطفة,إخلاص حنبولي,طاهر آل سلطان,آل رفيع-الخرافي,3.2133724993884463,2551.258090304432,Under Review,Cash,"Officiis culpa unde veritatis quos. Perspiciatis enim fugiat at nam.
Ullam quisquam suscipit ullam. Sequi ducimus incidunt dignissimos maiores quae."
40,474,Sublease,178770,2025-05-13,باهرة بن لادن,Marc Sutton,Mason Woods,"Campbell, Perez and Juarez",2.4635762409884254,8719.988500187774,Under Review,Cash,Participant economy voice bit window. Animal nearly peace indeed. Create else situation worry. Course compare relationship list out without professor line.
41,20,Sale,8368929,2023-12-17,سعدي الحجار,Emily Torres,قائد آل حسين,"Smith, Garcia and Harmon",2.1383292001279814,293922.11558210285,Under Review,Mortgage,Illo deserunt neque quas accusantium. Qui rerum amet reiciendis quas fugit repudiandae. Repellat dolorem magni aut. Perspiciatis minus nesciunt reiciendis minima expedita.
42,353,Assignment,77514,2024-04-08,Tara Harris,روفيدا الشايع,Michael Todd,Holt Ltd,4.361951665135058,1740.559657196316,Pending,Cash,Repellat cumque modi veniam. Eos odit numquam minus placeat consequuntur.
43,4,Lease,58537,2025-02-02,Alexander Jones,Alexis Weeks,Kathryn Silva,Martin-Mata,2.6814821122252717,2629.398032714044,Under Review,Cheque,Quia molestiae repellat sit eaque. Eveniet nostrum reiciendis distinctio. Perspiciatis excepturi ex dolor nesciunt incidunt. Quas quod ipsam eaque sit.
44,259,Assignment,191573,2025-03-21,Gavin Clay,Denise Jones,لبيد آل بن لافي,Williams-Bowen,4.815662070441155,4032.5146452319304,Completed,Cheque,"President name sort later. Size order hour TV miss nearly.
Political animal military order. According keep war second describe feeling husband."
45,470,Assignment,84396,2024-08-03,فرات العجلان,الدكتورة ديمه الحجار,زايد الخرافي,"الشايع, أبا الخيل and آل سعود",3.6883793187789817,2134.0754037781344,Pending,Cash,"Force road enough ask shoulder.
Left positive wear focus pressure son significant. Cup teach mean health or still reveal. Enter give let reality history whether carry."
46,353,Lease,106546,2024-11-18,جوان الحجار,الدكتور وجيه الدباغ,William Williamson,بن لادن-المشاولة,2.820532434699945,3684.983544327086,Completed,Cheque,Ten campaign forget right hit. System suddenly American foot ball remain. Until data final reality. Physical choice account soon.
47,360,Rent,183349,2025-05-13,مؤمن آل عواض,وجيه الشايع,رباح آل جعفر,White-Martinez,4.543043981128241,7258.606629911348,Completed,Bank Transfer,"Velit magni esse debitis. Commodi quia repellendus a.
Aliquid odit sed occaecati praesentium quae debitis totam. A dolores incidunt."
48,134,Lease,103524,2024-09-03,السيد موسى حنبولي,السيدة بلند الحكير,تميم آل عواض,Church Inc,3.549875275362386,4984.642685235495,Completed,Cash,"Accept service actually senior third cut. Claim my challenge.
Firm positive mother free sea wrong. Friend available never."
49,275,Sublease,184803,2023-09-14,عبد المجيد أبا الخيل,المهندسة ترانيم آل رفيع,الآنسة فرات آل جعفر,حجار-فصيل,2.7077851627108154,6842.914227327628,Completed,Bank Transfer,Every own goal. Sell where ever machine. Include Democrat father campaign others sort themselves. Same animal once amount surface order card.
50,321,Sublease,115605,2025-08-20,Thomas Mccullough,Ian Johnson,Jeremy Parsons,Gomez-Oneal,3.40882233932196,3249.579780703466,Under Review,Cash,"Possimus exercitationem consequatur et modi voluptates consequatur.
Dignissimos adipisci sequi. Voluptatem possimus dolores totam. Perspiciatis beatae quisquam voluptas commodi itaque."
51,271,Lease,73217,2025-02-16,Jeff Martin,عبد المجيد الشايع,تولين آل مقطة,بن لادن-آل عطفة,2.2822963563588354,2308.9232609982982,Cancelled,Cheque,"High fact history finish. End century break market early industry be. Past Mr almost employee mention just.
Shoulder whether arm full road matter rock same. Best world together surface throw option."
52,372,Sublease,111943,2024-05-13,هزار حنبولي,Anna Foley,إلينا آل مقطة,Hill-Turner,3.855676193853975,4302.401004005303,Pending,Cash,"Porro sequi voluptatum non nihil. Occaecati necessitatibus fugit accusamus dolor.
Perspiciatis quasi eaque odio nemo. Temporibus officia possimus saepe cupiditate totam voluptas. Ad eos facere."
53,114,Lease,60567,2024-02-03,Eric Martinez,طامح حجار,John Morrison,Carter Ltd,2.28587719454373,2777.683729599714,Completed,Cheque,"Strong boy term. Board huge coach truth collection.
Ago rest commercial financial several. Evening suddenly so summer. Behavior Congress perhaps medical."
54,151,Assignment,94409,2025-02-15,الدكتورة ضحى آل صفوان,بشرى آل عايض,المهندسة أزهار آل حسين,"Gilmore, Clark and Hall",2.772988510000056,2752.5865295953117,Pending,Bank Transfer,"Moment figure in present wish mean. Response treatment prevent oil. Material recognize pay ask. Know maybe boy and.
Class concern section able. Become scientist possible century maybe."
55,213,Sublease,114525,2025-06-17,Kristy Lewis,الأستاذ فاضل آل جعفر,Jacqueline Cooke,Young-Baker,3.9823703230504215,3598.6315716885706,Cancelled,Cheque,"Aspernatur occaecati aut. Omnis iste a ratione.
Velit veritatis odio enim voluptatibus veritatis veniam labore. Aut earum eos. Veniam pariatur animi provident assumenda."
56,485,Sublease,55211,2025-04-11,السيد عبد التّواب العقيل,مختار الحجار,الدكتورة سجا المغاولة,Palmer-Davis,2.402876707103701,1138.1823736342694,Completed,Cheque,"Whether edge security institution thousand. Year end current along someone.
Somebody occur value hear vote writer none."
57,282,Assignment,103830,2023-09-16,Douglas Burton,Carlos Smith,الأستاذة نشوة آل جعفر,"الخرافي, بن لادن and العجلان",4.741647996059804,4592.209140715021,Under Review,Mortgage,"Sapiente earum cupiditate ab.
Provident ullam qui commodi quis atque omnis. Excepturi architecto explicabo ut officia error iste. Quam veniam nam odit. Soluta sed error dolores."
58,63,Sublease,147903,2024-06-18,السيد ظاعن حجار,Donna Ortiz,Gary Banks,Rodriguez-Haynes,3.4644507089794154,3895.109755744826,Pending,Bank Transfer,"Factor mention line new. Teach song same recognize hour different.
Operation reality politics maintain evening sea bank attention."
59,271,Sale,9173425,2025-04-04,Christine Hill,Leslie Blackwell,Steven Rosales,Morrow-Williams,3.328180312200031,204614.62363480855,Under Review,Mortgage,Nostrum illo quasi veritatis voluptatum. Mollitia maiores odit voluptatibus temporibus ipsum at. Ex culpa nobis qui delectus aliquid quasi.
60,476,Lease,197104,2024-10-23,عثمان مهنا,أريج بن لادن,الآنسة ريتاج آل بن ظافر,الجابر-آل بن ظافر,2.1154063184929353,8038.685635764702,Completed,Cheque,Sed eum velit ipsum cum veniam. Incidunt quia aspernatur neque. Saepe occaecati quod vitae nesciunt quasi.
61,24,Sublease,190690,2023-12-23,Tony Lewis,Ashley Simpson,Rebecca Wilson,العليان-العليان,2.209649887217288,6691.084920536956,Completed,Cheque,"Quis quia expedita molestias ratione. Laudantium voluptate adipisci culpa voluptas optio quaerat.
Eos amet fugiat vel reiciendis."
62,222,Sale,10938965,2024-01-26,Vincent Graves,الدكتورة ماذى آل قصير,Mary Carr,"آل حسين, المغاولة and آل خضير",4.629818986890555,236042.98496070312,Completed,Bank Transfer,Can fight these anything dream but it across. Reach statement head yet. Section could candidate race fast.
63,492,Rent,75841,2024-05-04,Terry Reyes II,زين آل عطفة,Angela Harris,Anderson-Jones,3.4168656021554673,2182.21727935107,Pending,Cheque,"Story take spend. Rich against major job teach perhaps. Mind around prove as key list piece.
Whom political sure federal. Pattern yet scientist west just."
64,81,Assignment,57011,2025-02-17,Ryan Smith,Roger Vargas,Casey Williams,"الجفالي, مهنا and بن لادن",3.9323198423197137,2195.029622077062,Cancelled,Bank Transfer,"Million theory bad less health similar almost. Give free road chair skill carry.
Fact make room. Range security pass drop.
Interesting politics car."
65,55,Rent,122671,2023-10-03,James Munoz,مهدي آل محمد بن علي بن جماز,Sylvia Krueger,فصيل LLC,3.5333959508593393,4917.339367793152,Under Review,Mortgage,"Assumenda ullam incidunt. Qui soluta rerum voluptas quo.
Debitis praesentium nihil.
Quae beatae quod odio laborum. Omnis eveniet explicabo ipsam inventore."
66,166,Sublease,93059,2024-11-23,الدكتور نصري الجابر,Karen Patterson,سلاف مهنا,Parker Group,2.3913500836600927,4219.059764321549,Pending,Cash,Foot behind add. During two treatment set. Tell wrong west year teach this.
67,197,Sale,5356629,2024-04-06,المهندسة تولين آل مقطة,كاملة حنبولي,Michelle Wells,آل معيض-حجار,2.548905571903492,245213.53025019387,Completed,Bank Transfer,"Start yet bit development tax. Local down defense simple employee democratic. International should evidence wide learn so.
Success always business able. Right world realize while score."
68,162,Assignment,182349,2023-10-21,المهندس نوّاف حجار,نظمي آل عايض,William Williams,Powell-Lawrence,2.9575040123951486,4908.517183255073,Completed,Bank Transfer,Culture cause include. Still Republican question officer brother trip two fine. Under image maybe some.
69,439,Lease,65269,2025-05-09,وفيق العقيل,آيات آل حسين,Daisy Lewis,Bailey Ltd,4.895277400206506,2140.4815547022195,Completed,Mortgage,"Compare Mrs although return go last amount. Marriage we international general figure few couple.
Data almost toward attorney pay."
70,205,Assignment,120699,2024-11-10,Denise Mcgee,المهندس زياد آل خضير,Joseph Waters,Gibson-Barber,2.2163777635313733,4218.591965560584,Completed,Cheque,"Fall sport east charge many mind social. Option discuss between four. Cause beat there national family wait thought.
Budget contain sound behind floor each."
71,293,Assignment,167575,2023-12-25,Carolyn Taylor,خاشعة الشايع,Gavin Long,الشايع Group,3.6498153498346686,8219.818585516752,Completed,Bank Transfer,"Est totam sit delectus id.
Eius repudiandae assumenda praesentium nam vitae fuga id. Atque nobis omnis beatae iure voluptatum. Rerum ipsam ab quisquam odio amet."
72,471,Sale,9608110,2025-08-10,Debra Wilson,الآنسة ابتكار العجلان,Taylor Russell,Rivera-Roberts,3.2742927888996625,241879.0335051481,Completed,Mortgage,Quam perferendis porro odio. Magnam inventore nesciunt ad saepe. Accusamus maiores accusamus quas ipsa.
73,2,Assignment,101742,2024-10-13,عرفان آل علي,السيد نظمي الراشد,الأستاذ كرم العقيل,"آل عطفة, الراشد and آل حسين",3.5398116279564684,3487.253880790437,Pending,Cash,"Various may third.
With vote ground continue arrive. End produce prevent senior customer recent bad."
74,174,Lease,181169,2025-06-23,الأستاذ نعمان آل سلطان,Juan Vargas,يافع آل عايض,المهيدب-الشايع,3.0091155442738087,4283.28050282097,Completed,Cash,"Door thus these fly young. Material American pressure suggest high person guess go. Make trouble office.
Skill forget say yourself page bar education reason. Prove civil foot entire fact."
75,499,Lease,188647,2024-06-27,Aaron Grant,ريم آل بن لافي,Samantha Jones,Roach-Jones,4.615143384055934,5304.957807576472,Completed,Mortgage,Atque id voluptas porro cum. Labore cum fugiat amet consectetur earum. Sapiente exercitationem maiores inventore culpa quidem voluptates minima.
76,9,Lease,92346,2023-12-26,الدكتور طائع كانو,Nancy Hall,ريفال العقيل,Harper and Sons,4.369517144819695,3795.89934133699,Under Review,Bank Transfer,Deleniti dignissimos a ipsum inventore velit quisquam sed.
77,244,Lease,172806,2023-10-16,Kurt Turner,يونس الشايع,الدكتور عزّت الحجار,Collins-Strickland,4.160220873018926,5601.6739012339585,Under Review,Bank Transfer,Dolore necessitatibus veniam libero dicta. Distinctio ipsa asperiores quasi quo in tenetur. Eius natus soluta eum adipisci. Repudiandae perspiciatis fugit aut unde modi sit iste.
78,472,Rent,109920,2024-01-11,نوره المغاولة,Stephen Hodge,ديسم آل سعود,"Hudson, Manning and Lewis",2.380238768459094,2470.862075928862,Cancelled,Mortgage,"Voluptates deleniti iste. Perferendis voluptatum at. Architecto provident natus libero consequuntur minus.
Laudantium ullam nihil a. Repudiandae minima harum explicabo."
